{
  "$schema": "https://json-schema.org/draft/2020-12/schema",
  "$id": "https://we-build.example.com/schemas/companyinfo/1.0/sd-jwt-vc-schema.json",
  "title": "CompanyInfo SD-JWT VC Schema",
  "description": "Schema for the Company Information (CompanyInfo) Attestation encoded as SD-JWT VC, based on the WeBuild Attestation Rulebook and draft-ietf-oauth-sd-jwt-vc-09",
  "type": "object",

  "required": [
    "vct",
    "iss",
    "iat",
    "exp",
    "issuing_entity",
    "attestation_legal_category",
    "number_of_employees",
    "financial_statements"
  ],

  "properties": {

    "vct": {
      "type": "string",
      "const": "eu.we-build:companyinfo:1",
      "description": "Verifiable Credential Type — uniquely identifies the credential type. Always present in plain text. NOT selectively disclosable."
    },

    "iss": {
      "type": "string",
      "format": "uri",
      "description": "Issuer identifier — a URI identifying the issuer of the credential. As per RFC 7519. NOT selectively disclosable."
    },

    "iat": {
      "type": "integer",
      "minimum": 0,
      "description": "Issued At — Unix timestamp (seconds since epoch) indicating when the attestation was issued. NOT selectively disclosable."
    },

    "exp": {
      "type": "integer",
      "minimum": 0,
      "description": "Expiration Time — Unix timestamp after which the attestation is no longer valid. NOT selectively disclosable."
    },

    "nbf": {
      "type": "integer",
      "minimum": 0,
      "description": "Not Before — Unix timestamp before which the credential MUST NOT be accepted. Optional. NOT selectively disclosable."
    },

    "sub": {
      "type": "string",
      "description": "Subject — identifier for the subject of the credential (the legal entity). NOT selectively disclosable."
    },

    "issuing_entity": {
      "type": "string",
      "description": "Identifier of the legal entity that issued the attestation. For EAA this is the subject entity. For QEAA this is the QTSP. NOT selectively disclosable."
    },

    "attestation_legal_category": {
      "type": "string",
      "enum": ["EAA", "QEAA"],
      "description": "Legal category of this attestation under eIDAS 2. SHALL be 'EAA' or 'QEAA'. NOT selectively disclosable."
    },

    "schema_version": {
      "type": "string",
      "description": "Version of the schema used for this attestation. Optional metadata.",
      "examples": ["1.0"]
    },

    "trust_anchor_url": {
      "type": "string",
      "format": "uri",
      "description": "URL where the trust anchor for verifying this attestation can be retrieved. Optional metadata."
    },
    "issuing_entity": {
      "type": "string",
      "description": "The identifier of the legal entity that issued the attestation. Typically the subject entity itself for self-issued EAA attestations, or the QTSP identifier for QEAA attestations.",
      "examples": [
        "did:example:webuild-legal-entity-456",
        "did:example:qtsp-issuer-789"
      ]
    },
    "employee_number": {
      "type": "integer",
      "minimum": 0,
      "description": "Total number of employees in the legal entity at the time of reporting. SHALL be a non-negative integer.",
      "examples": [
        1250
      ]
    },

    "number_of_employees": {
      "type": "integer",
      "minimum": 0,
      "description": "Total number of employees in the legal entity at the time of reporting. SHALL be a non-negative integer. MUST be selectively disclosable (SD claim)."
    },

    "trade_alias": {
      "type": "array",
      "items": {
        "type": "string",
        "minLength": 1
      },
      "description": "Registered trade names or aliases under which the legal entity operates. MAY contain zero or more text values. Optional. MUST be selectively disclosable."
    },

    "previous_legal_name": {
      "type": "array",
      "items": {
        "type": "string",
        "minLength": 1
      },
      "description": "Previously registered legal name(s) of the entity. SHALL NOT contain the current legal name. Optional. MUST be selectively disclosable."
    },

    "status": {
      "type": "object",
      "description": "Status object per SD-JWT VC status-list mechanism. MUST be present when validity period is greater than 24 hours.",
      "additionalProperties": false,
      "properties": {
        "type": {
          "type": "string",
          "description": "Status mechanism type. For SD-JWT VC Status List this SHALL be 'status-list'.",
          "examples": [
            "status-list"
          ]
        },
        "status_list_credential": {
          "type": "string",
          "format": "uri",
          "description": "URI of the Status List Credential that contains the bitstring indicating revocation status.",
          "examples": [
            "https://issuer.webuildconsortium.eu/status/companyinfo/2025"
          ]
        },
        "status_list_index": {
          "type": "integer",
          "minimum": 0,
          "description": "Zero-based index into the status list bitstring for this credential.",
          "examples": [
            123
          ]
        },
        "status_purpose": {
          "type": "string",
          "description": "Purpose of the status entry. For CompanyInfo attestation this SHALL be 'revocation'.",
          "examples": [
            "revocation"
          ]
        }
      },
      "required": [
        "type",
        "status_list_credential",
        "status_list_index",
        "status_purpose"
      ]
    },
    "trust_anchor_url": {
      "type": "string",
      "format": "uri",
      "description": "URL at which a machine-readable version of the trust anchor used for verifying the CompanyInfo attestation can be found or looked up.",
      "examples": [
        "https://trust.webuildconsortium.eu/anchors/qtsp/eidas-tl"
      ]
    },
    "schema_version": {
      "type": "string",
      "description": "Version of the CompanyInfo attestation schema used.",
      "examples": [
        "1.0",
        "0.1.0"
      ]
    },
    "cnf": {
      "type": "object",
      "description": "Confirmation claims per SD-JWT VC. Holder binding via JWK is recommended.",
      "additionalProperties": false,
      "properties": {
        "jwk": {
          "type": "object",
          "description": "Public key bound to the holder.",
          "additionalProperties": true,
          "properties": {
            "kty": { "type": "string" },
            "crv": { "type": "string" },
            "x": { "type": "string" },
            "y": { "type": "string" },
            "n": { "type": "string" },
            "e": { "type": "string" }
          }
        }
      },
      "required": [
        "jwk"
      ]
    },

    "financial_statements": {
      "type": "object",
      "description": "Structured financial reporting data following a specified taxonomy. Mandatory. MUST be selectively disclosable as a unit.",
      "required": ["taxonomy", "facts"],
      "properties": {

        "taxonomy": {
          "type": "string",
          "description": "Financial reporting standard used to structure and label financial data.",
          "examples": [
            "IFRS",
            "US-GAAP",
            "LOCAL-GAAP",
            "OECD"
          ]
        },

        "facts": {
          "type": "array",
          "minItems": 1,
          "description": "List of reported financial facts. SHALL contain at least one Fact object.",
          "items": {
            "$ref": "#/$defs/Fact"
          }
        }
      },
      "required": [
        "taxonomy",
        "facts"
      ],
      "additionalProperties": false
    }
  },

  "$defs": {
    "Fact": {
      "type": "object",
      "title": "Financial Fact",
      "description": "A single reported financial data point associated with a specific reporting period, taxonomy concept, unit, and value.",
      "required": [
        "id",
        "concept",
        "value",
        "unit",
        "period_start",
        "period_end"
      ],
      "properties": {

        "id": {
          "type": "string",
          "minLength": 1,
          "description": "Unique identifier of the fact within the attestation. SHALL be unique within the facts array."
        },

        "concept": {
          "type": "string",
          "description": "Name of the reported financial metric. SHALL use a standardized concept code from Section 2.8.4.",
          "enum": [
            "Revenue",
            "Turnover",
            "CostOfSales",
            "GrossProfit",
            "OperatingExpenses",
            "EBIT",
            "NetIncome",
            "Assets",
            "CurrentAssets",
            "NonCurrentAssets",
            "Liabilities",
            "CurrentLiabilities",
            "Equity",
            "OperatingCashFlow",
            "InvestingCashFlow",
            "FinancingCashFlow",
            "NetCashFlow",
            "EBITDA",
            "GrossMargin",
            "NetMargin",
            "DebtToEquity"
          ]
        },

        "value": {
          "type": "number",
          "minimum": 0,
          "description": "Reported numeric value of the fact. SHALL be a non-negative numeric value where applicable."
        },

        "unit": {
          "type": "string",
          "minLength": 1,
          "description": "Unit of measurement. When representing a monetary value SHALL follow ISO 4217 (e.g., EUR, USD). Non-monetary: '%' or 'ratio'.",
          "examples": ["EUR", "USD", "GBP", "CHF", "%", "ratio"]
        },

        "period_start": {
          "type": "string",
          "format": "date",
          "pattern": "^\\d{4}-\\d{2}-\\d{2}$",
          "description": "Start date of the reporting period. SHALL be a valid ISO 8601 date (YYYY-MM-DD)."
        },

        "period_end": {
          "type": "string",
          "format": "date",
          "pattern": "^\\d{4}-\\d{2}-\\d{2}$",
          "description": "End date of the reporting period. SHALL be a valid ISO 8601 date (YYYY-MM-DD). SHALL be equal to or later than period_start."
        }
      }
    }
  },

  "additionalProperties": false
}